{
    "name": "band",
    "meta": {
        "uniqueId": "1234",
        "class": [ "foo", "bar", "baz" ],
        "id": "my-id"
    },
    "header": {
        "content": [
            {
                "name": "band_header",
                "headline": "This is my headline",
                "title": "Video Band"
            }
        ]
    },
    "body": {
        "layout": "4 4 4 flex",
        "content": [
            {
                "name": "card",
                "config": {
                    "theme": "dark"
                },
                "body": {
                    "content": [
                        {
                            "name": "video_embed",
                            "video": {
                                "video_src": "<iframe style=\"border: none \" srcdoc=\"<style>body{background: #c00}</style>\" ></iframe>"
                            },
                            "title": {
                                "href": "www.redhat.com",
                                "title": "Video Title",
                                "text": "Watch Video",
                                "target": "_self"
                            },
                            "summary": "JBoss solutions come in two different versions: developer community projects and enterprise products. Do you know which version to use when?"
                        }
                    ]
                }
            },
            {
                "name": "card",
                "config": {
                    "theme": "dark"
                },
                "body": {
                    "content": [
                        {
                            "name": "video_embed",
                            "video": {
                                "video_src": "<iframe style=\"border: none \" srcdoc=\"<style>body{background: #c00}</style>\" ></iframe>"
                            },
                            "title": {
                                "href": "www.redhat.com",
                                "title": "Video Title",
                                "text": "Watch Video",
                                "target": "_self"
                            },
                            "summary": "Why software-defined storage for the enterprise?"
                        }
                    ]
                }
            },
            {
                "name": "card",
                "config": {
                    "theme": "dark"
                },
                "body": {
                    "content": [
                        {
                            "name": "video_embed",
                            "video": {
                                "video_src": "<iframe style=\"border: none \" srcdoc=\"<style>body{background: #c00}</style>\" ></iframe>"
                            },
                            "title": {
                                "href": "www.redhat.com",
                                "title": "Video Title",
                                "text": "Watch Video",
                                "target": "_self"
                            },
                            "summary": "e-NABLE: Open technology, faster progress\n"
                        }
                    ]
                }
            }
        ]
    },
    "footer": {
        "content": [
            {
                "name": "cta",
                "config": {
                    "type": "primary"
                },
                "link": {
                    "href": "https://www.redhat.com/en/about/videos",
                    "title": "",
                    "text": "Explore all videos",
                    "target": "_self"
                }
            }
        ]
    }
}
